{
  "schema_version": "2026-05-29",
  "document_type": "app_config",
  "config_key": "app_config",
  "environment": "global",
  "environments": {
    "dev": {
      "label": "Test",
      "api_base_url": "https://dev.juniorbay.com",
      "dashboard_url": "https://d1aqp2mstwphx2.cloudfront.net",
      "checkout_base_url": "https://dev.juniorbay.com/checkout",
      "pages_base_url": "https://drjfn283z66uz.cloudfront.net",
      "favicon_url": "https://images.juniorbay.com/icon/favicon.png",
      "public_asset_base_url": "https://images.juniorbay.com",
      "feature_flags": {
        "custom_api_domain": true,
        "s3_page_publish": true
      },
      "pages_preview_base_url": "https://dev-live.juniorbay.com",
      "test_pages_host": "dev-test.juniorbay.com"
    },
    "prod": {
      "label": "Live",
      "api_base_url": "https://prod.juniorbay.com",
      "dashboard_url": "https://d3opu5au018ej1.cloudfront.net",
      "checkout_base_url": "https://prod.juniorbay.com/checkout",
      "pages_base_url": "https://dlxn0y34f7dbz.cloudfront.net",
      "favicon_url": "https://images.juniorbay.com/icon/favicon.png",
      "public_asset_base_url": "https://images.juniorbay.com",
      "feature_flags": {
        "custom_api_domain": true,
        "s3_page_publish": true
      },
      "pages_preview_base_url": "https://prod-live.juniorbay.com",
      "test_pages_host": "prod-test.juniorbay.com"
    }
  },
  "dashboard": {
    "display_order": 10,
    "editable_sections": [
      "environments"
    ]
  },
  "metadata": {
    "owner": "platform"
  },
  "updated_at": 1780358400
}
